{
  "schema_version": "2.0.0",
  "locale": "en-US",
  "classes": [
    {
      "id": "intrusion",
      "label": "Intrusion"
    },
    {
      "id": "decryption",
      "label": "Decryption"
    },
    {
      "id": "detection_alarm",
      "label": "Detection/Alarm"
    },
    {
      "id": "anti_system",
      "label": "Anti-System"
    },
    {
      "id": "evasion_stealth",
      "label": "Evasion/Stealth"
    },
    {
      "id": "protection",
      "label": "Protection"
    },
    {
      "id": "anti_program",
      "label": "Anti-Program"
    },
    {
      "id": "anti_personnel",
      "label": "Anti-Personnel"
    },
    {
      "id": "controller",
      "label": "Controller"
    },
    {
      "id": "utility",
      "label": "Utility"
    },
    {
      "id": "demon",
      "label": "Demon"
    },
    {
      "id": "multi_purpose",
      "label": "Multi-Purpose"
    },
    {
      "id": "daemon",
      "label": "Daemon"
    },
    {
      "id": "systemware",
      "label": "Systemware"
    },
    {
      "id": "upgraded_datawall",
      "label": "Upgraded Data Wall"
    },
    {
      "id": "transportation",
      "label": "Transportation"
    },
    {
      "id": "rache_special",
      "label": "Rache Special"
    },
    {
      "id": "misc_anti_program",
      "label": "Misc. Anti-Program"
    },
    {
      "id": "base_link",
      "label": "Base Link"
    },
    {
      "id": "virus",
      "label": "Virus"
    },
    {
      "id": "ambush",
      "label": "Ambush"
    },
    {
      "id": "datawall",
      "label": "Data Wall"
    },
    {
      "id": "code_gate",
      "label": "Code Gate"
    },
    {
      "id": "special",
      "label": "Special"
    }
  ],
  "programs": [
    {
      "class_ids": [
        "intrusion"
      ],
      "memory_model": {
        "kind": "fixed",
        "amount": 1
      },
      "price_model": {
        "kind": "fixed",
        "amount": 400
      },
      "platform": "cyberdeck",
      "loadable": true,
      "availability": "retail",
      "catalog_scope": "standard",
      "id": "hammer",
      "class_id": "intrusion",
      "name": "Hammer",
      "strength": {
        "base": 4
      },
      "memory": 1,
      "price": 400,
      "effect": "Reduces a Data Wall by 2D6 Strength per hit and alerts defenses within 10 spaces.",
      "icon": "A glowing red hammer.",
      "source": {
        "book": "Cyberpunk 2020 Core Rulebook",
        "pages": "137-141"
      }
    },
    {
      "class_ids": [
        "intrusion"
      ],
      "memory_model": {
        "kind": "fixed",
        "amount": 2
      },
      "price_model": {
        "kind": "fixed",
        "amount": 360
      },
      "platform": "cyberdeck",
      "loadable": true,
      "availability": "retail",
      "catalog_scope": "standard",
      "id": "jackhammer",
      "class_id": "intrusion",
      "name": "Jackhammer",
      "strength": {
        "base": 2
      },
      "memory": 2,
      "price": 360,
      "effect": "A quieter intrusion attack that reduces a Data Wall by 1D6 Strength per hit.",
      "icon": "A red jackhammer firing white energy bolts.",
      "source": {
        "book": "Cyberpunk 2020 Core Rulebook",
        "pages": "137-141"
      }
    },
    {
      "class_ids": [
        "intrusion"
      ],
      "memory_model": {
        "kind": "fixed",
        "amount": 5
      },
      "price_model": {
        "kind": "fixed",
        "amount": 660
      },
      "platform": "cyberdeck",
      "loadable": true,
      "availability": "retail",
      "catalog_scope": "standard",
      "id": "worm",
      "class_id": "intrusion",
      "name": "Worm",
      "strength": {
        "base": 2
      },
      "memory": 5,
      "price": 660,
      "effect": "Opens a Code or Data Wall from inside in two turns without raising an alarm.",
      "icon": "A gold robotic worm with neon-green eyes.",
      "source": {
        "book": "Cyberpunk 2020 Core Rulebook",
        "pages": "137-141"
      }
    },
    {
      "class_ids": [
        "decryption"
      ],
      "memory_model": {
        "kind": "fixed",
        "amount": 2
      },
      "price_model": {
        "kind": "fixed",
        "amount": 380
      },
      "platform": "cyberdeck",
      "loadable": true,
      "availability": "retail",
      "catalog_scope": "standard",
      "id": "codecracker",
      "class_id": "decryption",
      "name": "Codecracker",
      "strength": {
        "base": 3
      },
      "memory": 2,
      "price": 380,
      "effect": "Breaks Code Gates by dismantling their program structure.",
      "icon": "A thin white beam passing through the gate.",
      "source": {
        "book": "Cyberpunk 2020 Core Rulebook",
        "pages": "137-141"
      }
    },
    {
      "class_ids": [
        "decryption"
      ],
      "memory_model": {
        "kind": "fixed",
        "amount": 2
      },
      "price_model": {
        "kind": "fixed",
        "amount": 400
      },
      "platform": "cyberdeck",
      "loadable": true,
      "availability": "retail",
      "catalog_scope": "standard",
      "id": "wizards_book",
      "class_id": "decryption",
      "name": "Wizard's Book",
      "strength": {
        "base": 4,
        "situational": [
          {
            "value": 6,
            "when": "against Code Gates"
          }
        ]
      },
      "memory": 2,
      "price": 400,
      "effect": "Tests billions of keys; its Strength rises to 6 against Code Gates.",
      "icon": "A stream of blazing white symbols.",
      "source": {
        "book": "Cyberpunk 2020 Core Rulebook",
        "pages": "137-141"
      }
    },
    {
      "class_ids": [
        "decryption"
      ],
      "memory_model": {
        "kind": "fixed",
        "amount": 3
      },
      "price_model": {
        "kind": "fixed",
        "amount": 560
      },
      "platform": "cyberdeck",
      "loadable": true,
      "availability": "retail",
      "catalog_scope": "standard",
      "id": "raffles",
      "class_id": "decryption",
      "name": "Raffles",
      "strength": {
        "base": 5
      },
      "memory": 3,
      "price": 560,
      "effect": "Uses a sequence of questions to reveal passwords for Code Gates and File Locks.",
      "icon": "A dapper young man in early-1990s evening clothes.",
      "source": {
        "book": "Cyberpunk 2020 Core Rulebook",
        "pages": "137-141"
      }
    },
    {
      "class_ids": [
        "detection_alarm"
      ],
      "memory_model": {
        "kind": "fixed",
        "amount": 5
      },
      "price_model": {
        "kind": "fixed",
        "amount": 610
      },
      "platform": "cyberdeck",
      "loadable": true,
      "availability": "retail",
      "catalog_scope": "standard",
      "id": "watchdog",
      "class_id": "detection_alarm",
      "name": "Watchdog",
      "strength": {
        "base": 4
      },
      "memory": 5,
      "price": 610,
      "effect": "Detects illegal entry and alerts its owner or an external alarm.",
      "icon": "A large black metal dog with red eyes.",
      "source": {
        "book": "Cyberpunk 2020 Core Rulebook",
        "pages": "137-141"
      }
    },
    {
      "class_ids": [
        "detection_alarm"
      ],
      "memory_model": {
        "kind": "fixed",
        "amount": 5
      },
      "price_model": {
        "kind": "fixed",
        "amount": 700
      },
      "platform": "cyberdeck",
      "loadable": true,
      "availability": "retail",
      "catalog_scope": "standard",
      "id": "bloodhound",
      "class_id": "detection_alarm",
      "name": "Bloodhound",
      "strength": {
        "base": 3
      },
      "memory": 5,
      "price": 700,
      "effect": "Detects an intruder, traces the entry to its source and alerts its owner.",
      "icon": "A gunmetal hound with blue eyes and a neon collar.",
      "source": {
        "book": "Cyberpunk 2020 Core Rulebook",
        "pages": "137-141"
      }
    },
    {
      "class_ids": [
        "detection_alarm"
      ],
      "memory_model": {
        "kind": "fixed",
        "amount": 6
      },
      "price_model": {
        "kind": "fixed",
        "amount": 780
      },
      "platform": "cyberdeck",
      "loadable": true,
      "availability": "retail",
      "catalog_scope": "standard",
      "id": "pit_bull",
      "class_id": "detection_alarm",
      "name": "Pit Bull",
      "strength": {
        "base": 2
      },
      "memory": 6,
      "price": 780,
      "effect": "Detects and traces an intruder, then repeatedly cuts that access line.",
      "icon": "A compact steel dog with red eyes and a red neon collar.",
      "source": {
        "book": "Cyberpunk 2020 Core Rulebook",
        "pages": "137-141"
      }
    },
    {
      "class_ids": [
        "detection_alarm"
      ],
      "memory_model": {
        "kind": "fixed",
        "amount": 1
      },
      "price_model": {
        "kind": "fixed",
        "amount": 280
      },
      "platform": "cyberdeck",
      "loadable": true,
      "availability": "retail",
      "catalog_scope": "standard",
      "id": "see_ya",
      "class_id": "detection_alarm",
      "name": "See Ya",
      "strength": {
        "base": 3
      },
      "memory": 1,
      "price": 280,
      "effect": "Reveals invisible icons within one subgrid.",
      "icon": "A shimmering silver screen.",
      "source": {
        "book": "Cyberpunk 2020 Core Rulebook",
        "pages": "137-141"
      }
    },
    {
      "class_ids": [
        "detection_alarm"
      ],
      "memory_model": {
        "kind": "fixed",
        "amount": 1
      },
      "price_model": {
        "kind": "fixed",
        "amount": 280
      },
      "platform": "cyberdeck",
      "loadable": true,
      "availability": "retail",
      "catalog_scope": "standard",
      "id": "hidden_virtue",
      "class_id": "detection_alarm",
      "name": "Hidden Virtue",
      "strength": {
        "base": 3
      },
      "memory": 1,
      "price": 280,